Book Id,Title,Author,Author l-f,Additional Authors,ISBN,ISBN13,My Rating,Average Rating,Publisher,Binding,Number of Pages,Year Published,Original Publication Year,Date Read,Date Added,Bookshelves,Bookshelves with positions,Exclusive Shelf,My Review,Spoiler,Private Notes,Read Count,Recommended For,Recommended By,Owned Copies,Original Purchase Date,Original Purchase Location,Condition,Condition Description,BCID
9017983,Moving Applications to the Cloud on the Microsoft Azure� Platform,Eugenio Pace,"Pace, Eugenio","Dominic Betts, Scott Densmore, Ryan Dunn, Masashi Narumoto, Matias Woloski","=""0735649677""","=""9780735649675""",2,3.67,Microsoft Press,Paperback,176,2010,2010,,2014/01/02,my-background,my-background (#45),read,,,,1,,,1,,,unspecified,,
1659737,Speed Up Your Site: Web Site Optimization,Andrew B. King,"King, Andrew B.",,"=""0735713243""","=""9780735713246""",4,3.54,New Riders Publishing,Paperback,528,2003,2003,,2014/01/02,my-background,my-background (#44),read,,,,1,,,1,,,unspecified,,
9263923,Parallel Programming with Microsoft .NET: Design Patterns for Decomposition and Coordination on Multicore Architectures,Colin Campbell,"Campbell, Colin","Ralph Johnson, Ade Miller, Stephen Toub","=""0735651590""","=""9780735651593""",4,3.70,Microsoft Press,Paperback,224,2010,2010,,2014/01/02,my-background,my-background (#43),read,Velmi p����kn���� vkro����en���� do problematiky paraleln���� vykon����van����ho k����du.,,,1,,,1,,,unspecified,,
7049142,Showstopper! the Breakneck Race to Create Windows NT and the Next Generation at Microsoft,G. Pascal Zachary,"Zachary, G. Pascal",Pascal G. Zachary,"=""0759285780""","=""9780759285781""",4,4.14,eReads.com,Paperback,338,2009,1994,2013/04/20,2014/01/02,my-background,my-background (#42),read,,,,1,,,1,,,unspecified,,
6934600,The Definitive Guide To F#,Don Syme,"Syme, Don","Adam Granicz, Antonio Cisternino","=""1430224312""","=""9781430224310""",0,4.20,,,,2010,2010,,2014/01/02,my-background,my-background (#41),read,,,,1,,,1,,,unspecified,,
20408314,Responsive Web Design,Ethan Marcotte,"Marcotte, Ethan",,"=""098444257X""","=""""",4,4.14,A Book Apart,Paperback,150,,2011,2015/03/25,2014/01/02,"favorites, my-background","favorites (#13), my-background (#40)",read,"Hezký průvodce v tvorbě responsivních webů. Knížka není moc dlouhá a má plno zajímavých podnětů k přemýšlení. Hezky zapadá do koncepce ostatních knih z A Book Apart. Jen bych očekával u druhého aktualizovanáho vydání, že ta aktualizace bude trochu rozsáhlejší, občas jsou některé věci dost out of date. Např. v knize není ani jednou zmíněn prohlížeč Chrome. Nadruhou stranu je to celkem fuk, protože zmíněné postupy fungují.",,,1,,,1,,,unspecified,,
15812003,ClojureScript: Up and Running,Stuart Sierra,"Sierra, Stuart",Luke VanderHart,"=""1449327435""","=""9781449327439""",3,3.30,O'Reilly Media,Paperback,116,2012,2012,2013/12/07,2014/01/02,my-background,my-background (#39),read,,,,1,,,1,,,unspecified,,
3405043,Pro Windows Powershell,Hristo Deshev,"Deshev, Hristo",,"=""1590599403""","=""9781590599402""",0,3.80,Apress,Paperback,493,2008,2008,,2014/01/02,my-background,my-background (#38),read,,,,1,,,1,,,unspecified,,
17716085,Clojure Data Analysis Cookbook,Eric Rochester,"Rochester, Eric",,"=""178216264X""","=""9781782162643""",0,3.61,Packt Publishing,Paperback,342,2013,2013,2014/08/25,2014/01/02,my-background,my-background (#37),read,,,,1,,,1,,,unspecified,,
603232,"A Programmer's Introduction to C#, Second Edition",Eric Gunnerson,"Gunnerson, Eric",,"=""1893115623""","=""9781893115620""",0,3.28,Apress,Paperback,540,2001,2000,2004/01/01,2014/01/02,my-background,my-background (#36),read,,,,1,,,1,,,unspecified,,
853147,The Quick Python Book,Daryl D. Harms,"Harms, Daryl D.",Kenneth McDonald,"=""1884777740""","=""9781884777745""",0,3.87,Manning Publications,Paperback,422,2000,2000,,2014/01/02,my-background,my-background (#35),read,,,,1,,,1,,,unspecified,,
6487349,The Art of Unit Testing: With Examples in .NET,Roy Osherove,"Osherove, Roy",,"=""1933988274""","=""9781933988276""",3,4.10,Manning Publications,Paperback,320,2009,2009,2010/01/01,2014/01/02,my-background,my-background (#34),read,,,,1,,,1,,,unspecified,,
5060029,Hibernate Search in Action,Emmanuel Bernard,"Bernard, Emmanuel",John Griffin,"=""1933988649""","=""9781933988641""",0,3.38,Manning Publications,Paperback,450,2009,2008,2008/01/01,2014/01/02,my-background,my-background (#33),read,,,,1,,,1,,,unspecified,,
2364113,NHibernate in Action,Pierre Henri Kuaté,"Kuaté, Pierre Henri","Christian Bauer, Gavin King, Pierre Henri Kuate, Tobin Harris","=""1932394923""","=""9781932394924""",0,3.58,Manning Publications,Paperback,400,2009,2007,2009/01/01,2014/01/02,my-background,my-background (#32),read,,,,1,,,1,,,unspecified,,
12693642,Lean from the Trenches,Henrik Kniberg,"Kniberg, Henrik",,"=""1934356859""","=""9781934356852""",5,4.21,Pragmatic Bookshelf,Paperback,176,2011,2011,2013/06/12,2014/01/02,"favorites, my-background","favorites (#12), my-background (#31)",read,,,,1,,,1,,,unspecified,,
8928078,Test-Drive ASP.NET MVC,Jonathan McCracken,"McCracken, Jonathan",,"=""1934356530""","=""9781934356531""",2,3.19,Pragmatic Bookshelf,Paperback,250,2010,2010,2011/01/01,2014/01/02,my-background,my-background (#30),read,,,,1,,,1,,,unspecified,,
18467564,Seven Concurrency Models in Seven Weeks: When Threads Unravel,Paul   Butcher,"Butcher, Paul",,"=""1937785653""","=""9781937785659""",5,3.82,Pragmatic Bookshelf,Paperback,267,2014,2014,2014/06/22,2014/01/02,"favorites, my-background","favorites (#11), my-background (#29)",read,"Tuto knihu mohu doporučit všem, co to myslí s vývojem aspoň trochu vázně. A je jedno jestli dělají front-end v JavaScriptu, back-end v PHP nebo nějakou enterprise aplikaci. Každý si tam najde něco, co mu pomůže podívat se na problematiku efektivního psaní aplikací z trochu jiného úhlu.<br/> <br/>Je zde srozumitelně popsán rozdíl mezi konkurencí, paralelismem a asynchronicitou. Jsou zde popsány různé přístupy k řešení konkurenčních přístupů s přihlédnutím k tomu, na jakou množinu problémů jsou vhodněšní či na jaké zcela nevhodné.<br/><br/>Ukázky v knize jsou v různých jazycích - ať už v provařené Javě nebo Céčku, tak i v moderních jazycích jako je Clojure nebo Elixir. Pokud tyto jazyky vůbec neznáte, nebojte se. Kniha vás s Clojure i Elixirem seznámí tak, abyste ukázky nejen pochopili, ale abyste byli schopní napsat v nich netriviální programy. Nečekejte důvěrné seznámení, ale úvod do programování v Clojure, ve které je značná část ukázek, v typických scénářích jejího užití.<br/><br/>Já osobně jsem se dozvěděl mnoho a to se této problematice věnuji již drahnou dobu. Dle mého názoru by tato kniha neměla chybět v žádné knihovně.",,,1,,,1,,,unspecified,,
18399028,Web Development with Clojure: Build Bulletproof Web Apps with Less Code,Dmitri Sotnikov,"Sotnikov, Dmitri",,"=""1937785645""","=""9781937785642""",3,3.54,The Pragmatic Programmers,Paperback,232,2014,2013,2015/04/19,2014/01/02,my-background,my-background (#28),read,,,,1,,,1,,,unspecified,,
15758128,Co programátory ve škole neučí aneb Softwarové inženýrství v reálné praxi,Petr Paleta,"Paleta, Petr",,"=""8025100731""","=""9788025100738""",2,3.40,Computer Press,Paperback,336,2003,2003,,2014/01/02,my-background,my-background (#27),read,,,,1,,,1,,,unspecified,,
15732688,Agilní programování: metodiky efektivního vývoje softwaru,Václav Kadlec,"Kadlec, Václav",,"=""8025103420""","=""9788025103425""",4,3.20,Computer Press,Paperback,278,2004,2004,,2014/01/02,"favorites, my-background","favorites (#10), my-background (#26)",read,,,,1,,,1,,,unspecified,,
1311542,Continuous Integration: Improving Software Quality and Reducing Risk,Paul Duvall,"Duvall, Paul","Steve Matyas, Andrew Glover","=""0321336380""","=""9780321336385""",3,3.80,Addison-Wesley Professional,Paperback,283,2007,2007,2010/08/01,2014/01/02,my-background,my-background (#25),read,,,,1,,,1,,,unspecified,,
17869230,Introduction to Rx,Lee Campbell,"Campbell, Lee",,"=""""","=""""",3,3.70,,Kindle Edition,354,2012,2012,2011/01/01,2014/01/02,my-background,my-background (#24),read,,,,1,,,1,,,unspecified,,
17925612,The Coding Dojo Handbook,Emily Bache,"Bache, Emily",,"=""""","=""""",4,4.16,leanpub.com,ebook,127,2013,2013,2013/11/17,2014/01/02,my-background,my-background (#23),read,,,,1,,,1,,,unspecified,,
12351513,Kanban,David J. Anderson,"Anderson, David J.",,"=""""","=""""",4,3.98,Blue Hole Press Inc,Kindle Edition,278,2013,2010,2011/01/01,2014/01/02,"favorites, my-background","favorites (#9), my-background (#22)",read,,,,1,,,1,,,unspecified,,
10284614,The Clean Coder: A Code of Conduct for Professional Programmers,Robert C. Martin,"Martin, Robert C.",,"=""0137081073""","=""9780137081073""",5,4.28,Prentice Hall,Paperback,210,2011,2011,2011/07/01,2014/01/02,"favorites, my-background","favorites (#8), my-background (#21)",read,,,,1,,,1,,,unspecified,,
17255897,"The Phoenix Project: A Novel About IT, DevOps, and Helping Your Business Win",Gene Kim,"Kim, Gene","Kevin Behr, George Spafford","=""""","=""9780988262577""",5,4.27,IT Revolution Press,ebook,376,2013,2013,2013/08/21,2014/01/02,"favorites, my-background","favorites (#7), my-background (#20)",read,,,,1,,,1,,,unspecified,,
19397151,Programming Reactive Extensions and Linq,Jesse Liberty,"Liberty, Jesse",Paul Betts,"=""1430237481""","=""9781430237488""",1,2.70,Apress,ebook,180,2011,2011,,2014/01/02,my-background,my-background (#19),read,,,,1,,,1,,,unspecified,,
11889509,"Slack: Getting Past Burnout, Busywork, and the Myth of Total Efficiency",Tom DeMarco,"DeMarco, Tom",,"=""""","=""""",5,4.01,Crown Business,Kindle Edition,240,2001,2001,2014/03/17,2014/01/02,my-background,my-background (#18),read,,,,1,,,1,,,unspecified,,
13266133,Leaders in Computing - Changing the digital world,BCS the Chartered Institute for IT,"IT, BCS the Chartered Institute for","Brian Runciman, Steve Wozniak, Donald Ervin Knuth, Grady Booch, Linus Torvaulds, Vint Cerf, Karen Spärck Jones, Tim Berners-Lee, Jimmy Wales, Stephanie Shirley","=""""","=""""",3,3.62,British Informatics Society Limited,Kindle Edition,75,2011,2011,2013/08/23,2014/01/02,my-background,my-background (#17),read,,,,1,,,1,,,unspecified,,
21841698,Understanding the Four Rules of Simple Design,Corey Haines,"Haines, Corey",,"=""""","=""""",4,4.13,,ebook,83,2014,2014,2014/04/02,2014/04/03,"favorites, my-background","favorites (#6), my-background (#16)",read,"Corry je jedním ze zakladatelů akce jménem Code Retreat. Jako dlouholetý facilitátor má možnost sledovat, jak různí vývojáři přistupují k tvorbě kódu a řešení problémů. Je to úžasný způsob, jak se učit a ověřovat své znalosti.<br/><br/>Kniha se zaměřuje na celkem úzce vymezené téma - 4 pravidla jednoduchého návrhu. Prochází pravidlo za pravidlem, ukazuje na různá řešení, která tyto pravidla porušují nebo naopak dodržují a jaké to má implikace na udržitelnost a případnou rozšiřitelnost návrhu.<br/><br/>Corry se také snaží vyvrátit některý zažité desinterpretace některých známých pravidel, jako je třeba DRY nebo co to je duplicita.<br/><br/>Mně osobně pomohla ujasnit si některé věci a doufám, že i posunout mě dál v roli facilitátora Code Retreatu.",,,1,,,0,,,,,
19193401,Moving Applications to the Cloud on the Microsoft AzureTM Platform (Patterns & Practices),Matias Woloski,"Woloski, Matias","Eugenio Pace, Dominic Betts, Scott Densmore, Ryan Dunn, Masashi Narumoto","=""""","=""""",3,3.33,Microsoft Press,Kindle Edition,176,2010,2010,2010/11/01,2014/06/05,my-background,my-background (#15),read,,,,1,,,0,,,,,
12867851,Cesta kaizen: Z malého kroku k velkému skoku,Robert Maurer,"Maurer, Robert",,"=""""","=""""",5,4.08,Pavel Dobrovský - BETA,Paperback,144,2005,2009,2013/08/21,2014/07/17,my-background,my-background (#13),read,,,,1,,,0,,,,,
17935767,CSS Animations (Pocket Guide),Val Head,"Head, Val",,"=""""","=""9781907828188""",3,3.68,5 Simple Steps,ebook,65,2013,2013,2014/08/01,2014/08/01,my-background,my-background (#12),read,,,,1,,,0,,,,,
15992715,An Introduction to Programming in Go,Caleb Doxsey,"Doxsey, Caleb",,"=""9781478355""","=""""",3,3.77,Creative  Commons  3.0,ebook,161,2012,2012,2015/03/15,2014/08/01,my-background,my-background (#11),read,"Rychlé intro do jazyka Go. Na mně je tam až příliš detailů pro začátečníky, ale chápu že nejsem cílovka. I tak jsem se seznámil se syntaxí a některými odlišnostmi a to za dvě hodiny. Za mně dobrý.",,,1,,,0,,,,,
22800559,Responsive Typography,Jason Pamental,"Pamental, Jason",,"=""1491907096""","=""9781491907092""",4,3.81,Adams Media,Paperback,110,2014,2014,2015/04/02,2014/08/01,"my-background, favorites","my-background (#10), favorites (#5)",read,"Velice dobře zpracovaná kniha o responsivním designuv souvislosti s typorafií. Skvěle mi zapadla do konceptu předchozích knih ([b:Mobile First|12910749|Mobile First|Luke Wroblewski|https://d.gr-assets.com/books/1318982714s/12910749.jpg|18065548], [b:Responsive Web Design|9815906|Responsive Web Design|Ethan Marcotte|https://d.gr-assets.com/books/1291401033s/9815906.jpg|16313898], [b:Responsive & Fast : Implementing High-Performance Responsive Design|22600901|Responsive & Fast   Implementing High-Performance Responsive Design|Guy Podjarny|https://d.gr-assets.com/books/1404019495s/22600901.jpg|42086535]) a pěkně to celé uzavřela a rozšířila. Vypadlo mi z toho jak vlastně k tvorbě stránek přistuju podvědomě už delší dobu: <br/><br/>Content First -  web začínáme stavět od samotného obsahu, na základě kterého vybíráme vhodné fonty a ladíme celkovou typografii. <br/>Mobile next - následuje layoutování pro mobilní zařízení.<br/>Progressive enhancement - přizpůsobujeme jak typografii, tak layouty pro vyšší rozlišení.<br/><br/>Doporučuju",,,1,,,0,,,,,
12910749,Mobile First,Luke Wroblewski,"Wroblewski, Luke",,"=""""","=""9781937557027""",3,3.91,A Book Apart,Paperback,130,2011,2011,2014/08/05,2014/08/03,my-background,my-background (#9),read,,,,1,,,0,,,,,
1001606,eXtreme Programming eXplained : embrace change,Kent Beck,"Beck, Kent",,"=""0201616416""","=""9780201616415""",5,4.08,Addison-Wesley,Paperback,190,2000,1999,2012/05/01,2014/08/04,"favorites, my-background","favorites (#4), my-background (#8)",read,,,,1,,,1,,,unspecified,,
18623259,The Twelve-Factor App,Adam Wiggins,"Wiggins, Adam",,"=""""","=""""",4,4.21,,ebook,39,2012,2012,2014/08/17,2014/08/17,my-background,my-background (#7),read,"Krátká knížka, kterou přelousknete za cestu autobusem. Přesto obsahuje v hutné formě spoustu zajímavých tipů, jak psát snadno deployovatelné a managovatelné webové služby (SaaS).<br/><br/>I když kniha předpokládá, že budete deployovat na UNIX like systém, jistě se dají tyto praktiky aplikovat i do světa Windows. Osobně jsem spoustu z nich na Windows praktikoval.<br/><br/>Doporočuji k přečtení všem, i těm, co zrovna SaaS nepíší.   ",,,1,,,0,,,,,
20358837,Getting Value out of Agile Retrospectives - A Toolbox of Retrospective Exercises,Luis Gonçalves,"Gonçalves, Luis",Ben Linders,"=""""","=""""",3,3.75,InfoQ and Leanpub (Self Published),ebook,76,2013,2013,2014/09/02,2014/08/31,my-background,my-background (#6),read,,,,1,,,0,,,,,
23016056,The Nature of Software Development,Ron Jeffries,"Jeffries, Ron",,"=""""","=""""",5,4.11,Pragmatic Programmers,,,,2015,2014/09/20,2014/09/10,"favorites, my-background","favorites (#3), my-background (#5)",read,"Tato kniha si neklade za cíl zavádět nějkou novou metodiku vývoje. Místo toho se autor snaží čtenáře seznámit s postupy, které se jemu osvědčili za 50 let praxe. Tyto metody úzce souvisí s agilním přístupem. Kniha se mi moc dobře četla a je doplněná i o zajímavé ilustace. Až bude tiskem, bude jistě součástí mého vánočního balíčku knih pro oblíbené manažery. :)",,,1,,,0,,,,,
21799444,Reactive Design Patterns,Roland Kuhn,"Kuhn, Roland",Jamie  Allen,"=""1617291803""","=""9781617291807""",4,3.60,Manning Publications Co.,ebook,325,2014,2014,2014/12/30,2014/10/28,my-background,my-background (#4),read,"Kniha zatím obsahuje jen první 3 kapitoly, které jsou i tak celkem obsáhlé. Reaktivní architektura je věc o kterou se zajímám již několik let a tak jsem si chtěl přečíst nějaký ucelený kousek na toto téma. A byla to poměrně dobrá volba. Autor je sice architektem Akka a tak často dochází k vychvalování Akky a Scaly, ale člověk to musí brát trochu s rezervou. Jde hlavně o architektonická řešení a postupy. technologie přicházejí a odcházejí a nejsou zas tak důležité...",,,1,,,0,,,,,
15834745,CSS Kaskádové styly: Kompletní průvodce,Petr Staníček,"Staníček, Petr",,"=""8072268724""","=""""",0,4.00,Computer Press,Paperback,178,2003,2003,2015/03/03,2015/03/03,"my-background, favorites","my-background (#3), favorites (#2)",read,,,,1,,,0,,,,,
22600901,Responsive & Fast : Implementing High-Performance Responsive Design,Guy Podjarny,"Podjarny, Guy",,"=""""","=""9781491906606""",4,3.71,O’Reilly,ebook,49,2014,2014,2015/03/26,2015/03/25,"my-background, favorites","my-background (#2), favorites (#1)",read,"Velmi krátká, ale zato úzce zaměřená kniha na to, jak dělat responsivní weby pořádně. Pro dokreslení technik RWD, aby to začalo dávat smysl, je to určitě must have.",,,1,,,0,,,,,
12910715,Designing for Emotion,Aarron Walter,"Walter, Aarron",,"=""""","=""9781937557003""",3,3.97,A Book Apart,Paperback,104,2011,2011,2015/04/16,2015/04/07,my-background,my-background (#1),read,"Určitě zajímavý pohled na to, jak přistupovat k designu a user experience. Case studies jsou zajímavé, jen už odstup těch několika let je celkem znát. Každopádně principy se nemění a jsou stále platné a o to jde. Určitě doporučuji přečíst.",,,1,,,0,,,,,
19104722,Puppet 3 Beginner's Guide,John Arundel,"Arundel, John",,"=""1782161252""","=""9781782161257""",0,3.72,Packt Publishing,ebook,204,2013,2013,,2014/01/02,to-read,to-read (#7),to-read,,,,0,,,1,,,unspecified,,
8686650,"Continuous Delivery: Reliable Software Releases Through Build, Test, and Deployment Automation",Jez Humble,"Humble, Jez",David  Farley,"=""0321601912""","=""9780321601919""",0,4.18,Addison-Wesley Professional,Hardcover,463,2010,2010,,2014/01/02,to-read,to-read (#30),to-read,,,,0,,,1,,,unspecified,,
343,Perfume: The Story of a Murderer,Patrick Süskind,"Süskind, Patrick",John E. Woods,"=""0140120831""","=""9780140120837""",0,4.02,Penguin Books,Paperback,263,1987,1985,,2014/09/23,to-read,to-read (#29),to-read,,,,0,,,0,,,,,
11502159,Koncernová pětiletka,Patrick Zandl,"Zandl, Patrick",,"=""9788087538""","=""""",4,4.09,Bookanyr,ebook,59,2011,2011,,2014/09/22,,,read,,,,1,,,0,,,,,
10188688,Flotila Země,Patrick Zandl,"Zandl, Patrick",,"=""""","=""2940000904534""",4,3.94,Patrick Zandl,Nook,206,2010,2006,,2014/09/22,,,read,,,,1,,,0,,,,,
6710247,The White Disease,Karel Čapek,"Čapek, Karel",Michael Henry Heim,"=""""","=""""",3,4.29,Theatre Communications Group,Paperback,63,1988,1937,,2014/09/22,,,read,,,,1,,,0,,,,,
1050948,Makropoulos Secret,Karel Čapek,"Čapek, Karel",,"=""0828314470""","=""9780828314473""",0,4.05,Branden Books,Paperback,,1925,1922,,2014/09/22,to-read,to-read (#28),to-read,,,,0,,,0,,,,,
23212601,Web ostrý jako břitva,Jan Řezáč,"Řezáč, Jan",,"=""""","=""9788087923016""",0,4.27,Baroque Partners,Paperback,214,2014,2014,,2014/09/22,to-read,to-read (#27),to-read,,,,0,,,0,,,,,
13455725,Open Advice,Lydia Pintscher,"Pintscher, Lydia",,"=""""","=""9781105514937""",0,3.53,,Paperback,308,2012,2012,,2014/09/10,to-read,to-read (#26),to-read,,,,0,,,0,,,,,
8694125,Alone Together: Why We Expect More from Technology and Less from Each Other,Sherry Turkle,"Turkle, Sherry",,"=""0465010210""","=""9780465010219""",0,3.63,Basic Books,Hardcover,360,2011,2011,,2014/09/10,to-read,to-read (#25),to-read,,,,0,,,0,,,,,
6278270,The Principles of Product Development Flow: Second Generation Lean Product Development,Donald G. Reinertsen,"Reinertsen, Donald G.",,"=""1935401009""","=""9781935401001""",0,4.17,Celeritas Publishing,Hardcover,276,2009,2009,,2014/09/10,to-read,to-read (#24),to-read,,,,0,,,0,,,,,
22605938,Working Effectively with Unit Tests,Jay Fields,"Fields, Jay",Michael C. Feathers,"=""""","=""""",0,3.98,leanpub,ebook,204,2014,2014,,2014/09/04,to-read,to-read (#23),to-read,,,,0,,,0,,,,,
18975021,The Original Reiki Handbook of Dr. Mikao Usui,Mikao Usui,"Usui, Mikao",Christine M. Grimm,"=""""","=""9780940676770""",3,4.27,Lotus Press,Kindle Edition,79,1999,1999,2013/12/26,2014/01/02,,,read,,,,1,,,1,,,unspecified,,
17403745,Manage Your Job Search,Johanna Rothman,"Rothman, Johanna",,"=""""","=""""",0,4.28,,ebook,,,2014,2014/08/31,2014/04/12,,,read,,,,1,,,0,,,,,
870572,How to Make Love All Night: And Drive a Woman Wild!,Barbara Keesling,"Keesling, Barbara",,"=""006092621X""","=""9780060926212""",0,3.85,William Morrow Paperbacks,Paperback,192,2007,1994,2014/08/31,2014/01/02,,,read,,,,1,,,1,,,unspecified,,
16145629,Kříž u potoka,Karolina Světlá,"Světlá, Karolina",,"=""""","=""""",0,4.01,Knihovnička,Paperback,220,,1968,2014/08/26,2014/08/25,,,read,,,,1,,,0,,,,,
10883803,Clojure Programming,Chas Emerick,"Emerick, Chas","Brian Carper, Christophe Grand","=""1449394701""","=""9781449394707""",0,4.16,O'Reilly Media,Paperback,630,2012,2011,,2014/01/04,to-read,to-read (#22),to-read,,,,0,,,0,,,,,
4414681,Foundations Of Logic Programming,J.W. Lloyd,"Lloyd, J.W.",,"=""0387132996""","=""9780387132990""",0,4.50,Springer,Hardcover,124,1984,1984,,2014/08/23,to-read,to-read (#21),to-read,,,,0,,,0,,,,,
12841318,"Datalog Reloaded: First International Workshop, Datalog 2010, Oxford, UK, March 16-19, 2010. Revised Selected Papers",Oege de Moor,"Moor, Oege de","Georg Gottlob, Tim Furche, Andrew Sellers","=""3642242057""","=""9783642242052""",0,0.0,Springer,Paperback,398,2011,2011,,2014/08/23,to-read,to-read (#20),to-read,,,,0,,,0,,,,,
18881447,The Moon-Voyage,Jules Verne,"Verne, Jules",,"=""""","=""""",3,3.55,,Kindle Edition,352,2012,2009,2014/08/09,2014/08/05,,,read,,,,1,,,0,,,,,
33411,War with the Newts,Karel Čapek,"Čapek, Karel","M. Weatherall, R. Weatherall, Ivan Klíma","=""0810114682""","=""9780810114685""",4,4.17,Northwestern University Press,Paperback,348,1996,1936,2011/01/01,2014/01/02,,,read,,,,1,,,1,,,unspecified,,
774928,"Rendezvous with Rama (Rama, #1)",Arthur C. Clarke,"Clarke, Arthur C.",,"=""0553287893""","=""9780553287899""",4,4.03,Spectra,Paperback,245,1990,,2012/12/01,2014/01/02,,,read,,,,1,,,1,,,unspecified,,
533653,Cloud Atlas,David Mitchell,"Mitchell, David",,"=""0340822775""","=""9780340822777""",5,4.00,Sceptre,Hardcover,531,2004,2004,2012/10/25,2014/01/02,,,read,,,,1,,,1,,,unspecified,,
337109,Paris in the Twentieth Century,Jules Verne,"Verne, Jules","Richard Howard, Eugen Weber","=""034542039X""","=""9780345420398""",4,3.38,Del Rey,Paperback,222,1997,1994,2013/05/02,2014/01/02,,,read,,,,1,,,1,,,unspecified,,
11468377,"Thinking, Fast and Slow",Daniel Kahneman,"Kahneman, Daniel",,"=""0374275637""","=""9780374275631""",0,4.16,"Farrar, Straus and Giroux",Hardcover,499,2011,2011,,2014/08/01,to-read,to-read (#19),to-read,,,,0,,,0,,,,,
15811999,Introducing Erlang: Getting Started in Functional Programming,Simon St. Laurent,"Laurent, Simon St.",,"=""1449331769""","=""9781449331764""",0,3.81,O'Reilly Media,Paperback,204,2013,2012,,2014/08/01,to-read,to-read (#18),to-read,,,,0,,,0,,,,,
17971957,Programming Elixir: Functional |> Concurrent |> Pragmatic |> Fun,Dave Thomas,"Thomas, Dave",,"=""1937785580""","=""9781937785581""",0,4.29,The Pragmatic Bookshelf,Paperback,287,2013,2013,,2014/08/01,to-read,to-read (#17),to-read,,,,0,,,0,,,,,
67825,Peopleware: Productive Projects and Teams,Tom DeMarco,"DeMarco, Tom",Timothy R. Lister,"=""0932633439""","=""9780932633439""",0,4.17,"Dorset House Publishing Company, Incorporated",Paperback,245,1999,1987,,2014/04/12,to-read,to-read (#16),to-read,,,,0,,,0,,,,,
17623617,The Joy of Clojure,Michael Fogus,"Fogus, Michael",Chris Houser,"=""1617291412""","=""9781617291418""",4,4.18,Manning Publications,Paperback,477,2014,2010,,2014/04/24,currently-reading,currently-reading (#1),currently-reading,,,,1,,,0,,,,,
112520,"Rama II (Rama, #2)",Arthur C. Clarke,"Clarke, Arthur C.",Gentry Lee,"=""2290032042""","=""9782290032046""",4,3.69,J'ai lu,Paperback,480,1996,1989,2014/02/01,2014/02/09,,,read,,,,1,,,0,,,,,
19052163,Příběh strýčka Martina,Patrick Zandl,"Zandl, Patrick",,"=""""","=""""",5,3.83,,ebook,,2013,2013,2014/01/09,2014/01/02,,,read,,,,1,,,0,,,,,
4102,Practices of an Agile Developer: Working in the Real World,Venkat Subramaniam,"Subramaniam, Venkat",Andy Hunt,"=""097451408X""","=""9780974514086""",0,3.88,Pragmatic Bookshelf,Paperback,189,2006,2006,,2014/01/02,to-read,to-read (#15),to-read,,,,0,,,0,,,,,
4268826,"Growing Object-Oriented Software, Guided by Tests",Steve  Freeman,"Freeman, Steve",Nat Pryce,"=""0321503627""","=""9780321503626""",0,4.19,Addison-Wesley Professional,Paperback,345,2009,2009,,2014/01/02,to-read,to-read (#14),to-read,,,,0,,,1,,,unspecified,,
3226758,Real World Haskell: Code You Can Believe In,Bryan O'Sullivan,"O'Sullivan, Bryan","John Goerzen, Donald Bruce Stewart","=""0596514980""","=""9780596514983""",0,3.92,O'Reilly Media,Paperback,720,2008,2008,,2014/01/02,to-read,to-read (#13),to-read,,,,0,,,1,,,unspecified,,
17152732,Vagrant: Up and Running,Mitchell Hashimoto,"Hashimoto, Mitchell",,"=""1449335837""","=""9781449335830""",0,3.75,O'Reilly Media,Paperback,158,2013,2013,,2014/01/02,to-read,to-read (#12),to-read,,,,0,,,1,,,unspecified,,
